Name,Rule Book Description,Compulsory,Notes
Bloodlust (X+),"To keep control of their wits, Vampires need a supply of fresh blood. Whenever a player with this Trait activates, after declaring their action, they must roll a D6, adding I to the roll if they declared a Block action or a Blitz action. If they roll equal to or higher than the number shown in brackets, they may activate as normal.

If the player rolls lower than the number shown in brackets, or rolls a natural 1, they may continue their activation as normal though they may change their declared action to a Move action if they wish. If the player declared an action that can only be performed once per team turn (such as a Blitz action) this will still count as the one of that action for the team turn. At the end of their activation they may bite an adjacent Thrall Lineman teammate (Standing, Prone or Stunned). If they bite a Thrall, immediately make an Injury roll for the Thrall treating any Casualty result as Badly Hurt; this will not cause a Turnover unless the Thrall was holding the ball. If they do not bite a Thrall for any reason then a Turnover is caused, the player will lose their Tackle Zone until they are next activated, and will immediately drop the ball if they were holding it. If the player was in the opposing End Zone, no touchdown is scored. If a player who failed this roll wants to make a Pass action, Hand-off, or score then they must bite a Thrall before they perform the action or score.",TRUE,Spike 16
Drunkard,This player suffers a -1 penality to the dice roll when attempting to Rush.,,Spike 14
Pick-me-up,"At the end of the opposition's team turn, roll a D6 for each Prone, non-Stunned team-mate within three squares of a standing player with this Trait. On a 5+, the Prone player may immediately stand up.",,Spike 14
My Ball,"A player with this Trait may not willingly give up the ball when in possession of it, and so may not make Pass actions, Hand-off actions, or use any other Skill or Trait that would allow them to relinquish possession of the ball. The only way they can lose possession of the ball is by being Knocked Down, Placed Prone, Falling Over or by the effect of a Skill, Trait, or special rule of an opposing model.",,Spike 17
Trickster,"When this player is about to be hit by a Block action or a Special action that replaces a Block action (with the exception of a Block action caused by the Ball and Chain Move Special action), before determining how many dice are rolled, they may be removed from the pitch and placed in any other unoccupied square adjacent to the player performing the Block action. The Block action then takes place as normal. If the player using this Trait is holding the ball and places themselves in the opposition End Zone, the Block action will still be fully resolved before any touchdown is resolved.",,Spike 17
Ball and Chain,"When this player is activated, the only action they may perform is a 'Ball & Chain Move' Special action. There is no limit to how many players with this Trait may perform this Special action each team turn.

When this player performs this Special action:

* Place the Throw-in template over the player, facing towards either End Zone or either sideline as you wish.
* Roll a D6 and move the player one square in the direction indicated.
* A player with a Ball & Chain automatically passes any Agility tests they may be required to make in order to Dodge, regardless of any modifiers.
* If this movement takes the player off the pitch, they risk Injury by the Crowd.
* If this movement takes the player into a square in which the ball is placed, the player is considered to have moved involuntarily. Therefore, they may not attempt to pick the ball up and the ball will bounce.

Repeat this process for each square the player moves.

If this player would move into a square that is occupied by a Standing player from either team, they must perform a Block action against that player, following the normal rules, but with the following exceptions:

* A Ball & Chain player ignores the Foul Appearance skill.
* A Ball & Chain player must follow-up if they push-back another player.

If this player moves into a square that is occupied by a Prone or Stunned player from either team, for any reason, that player is immediately pushed back and an Armour roll is made against them.

This player may Rush. Declare that the player will Rush before placing the Throw-in template and rolling the D6 to determine direction:

* If this player Rushes into an unoccupied square, move them as normal and roll a D6:
    - On a roll of 2+, this player moves without mishap.
    - On a roll of 1 (before or after modification), the player Falls Over.
* If this player Rushes into a square that is occupied by a standing player from either team, roll a D6:
    - On a roll of 2+, this player moves without mishap and will perform a Block action against the player occupying the square as described previously.
    - On a roll of 1 (before or after modification), the player occupying the square is pushed back and this player will Fall Over after moving into the vacated square.

If this player ever Falls Over, is Knocked Down or is Placed Prone, an Injury roll is immediately made against them (no Armour roll is required), treating a Stunned result as a KO'd result.

A player with this Trait cannot also have the Diving Tackle, Frenzy, Grab, Leap, Multiple Block, On the Ball or Shadowing skills.",,AS2021

