Name,Rule Book Description,Compulsory,Notes
Always Hungry,"If this player wishes to perform a Throw Team-mate action, roll a D6 after they have finished moving, but before they throw their team-mate. On a roll of 2+, continue with the throw as normal. On a roll of 1, this player will attempt to eat their team-mate. Roll another D6:

* On a roll of 1, the team-mate has been eaten and is immediately removed from the Team Draft list. No apothecary can save them and no Regeneration attempts can be made. If the team-mate was in possession of the ball, it will bounce from the square this player occupies.
* On a roll of 2+, the team-mate squirms free and the Throw Team-mate action is automatically fumbled, as described on page 53.",TRUE,
Animal Savagery,"When this player is activated, even if they are Prone or have lost their Tackle Zone, immediately after declaring the action they will perform but before performing the action, roll a D6, applying a +2 modifier to the dice roll if you declared the player would perform a Block or Blitz action (or a Special action granted by a Skill or Trait that can be performed instead of a Block action):

* On a roll of 1-3, this player lashes out at their team-mates:
  - One Standing team-mate of your choice that is currently adjacent to this player is immediately Knocked Down by this player. This does not cause a Turnover unless the Knocked Down player was in possession of the ball. After making an Armour roll(and possible Injury roll) against the Knocked Down player, this player may continue their activation and complete their declared action if able. Note that, if this player has any applicable Skills, the coach of the opposing team may use them when making an Armour roll (and possible Injury roll) against the Knocked Down player.
  - If this player is not currently adjacent to any Standing team-mates, this player’s activation ends immediately. Additionally, this player loses their Tackle Zone until they are next activated.
* On a roll of 4+, this player continues their activation as normal and completes their declared action.

If you declared that this player would perform an action which can only be performed once per team turn and this player’s activation ended before the action could be completed, the action is considered to have been performed and no other player on your team may perform the same action this team turn.",TRUE,
Animosity (X),"This player is jealous of and dislikes certain other players on their team, as shown in brackets after the name of the Skill on this player’s profile. This may be defined by position or race. For example, a Skaven Thrower on an Underworld Denizens team has Animosity (Underworld Goblin Linemen), meaning they suffer Animosity towards any Underworld Goblin Linemen players on their team. Whereas a Skaven Renegade on a Chaos Renegade team has Animosity (all team-mates), meaning they suffer Animosity towards all of their team-mates equally.

When this player wishes to perform a Hand-off action to a team-mate of the type listed, or attempts to perform a Pass action and the target square is occupied by a team-mate of the type listed, this player may refuse to do so. Roll a D6. On a roll of 1, this player refuses to perform the action and their activation comes to an end. Animosity does not extend to Mercenaries or Star Players.",TRUE,
Ball & Chain,"When this player is activated, the only action they may perform is a ‘Ball & Chain Move’ Special action. There is no limit to how many players with this Trait may perform this Special action each team turn.

When this player performs this Special action:

* Place the Throw-in template over the player, facing towards either End Zone or either sideline as you wish.
* Roll a D6 and move the player one square in the direction indicated.
* A player with a Ball & Chain automatically passes any Agility tests they may be required to make in order to Dodge, regardless of any modifiers.
* If this movement takes the player off the pitch, they risk Injury by the Crowd.
* If this movement takes the player into a square in which the ball is placed, the player is considered to have moved involuntarily. Therefore, they may not attempt to pick the ball up and the ball will bounce.

Repeat this process for each square the player moves.

If this player would move into a square that is occupied by a Standing player from either team, they must perform a Block action against that player, following the normal rules, but with the following exceptions:

* A Ball & Chain player ignores the Foul Appearance skill.
* A Ball & Chain player must follow-up if they push-back another player.

If this player moves into a square that is occupied by a Prone or Stunned player from either team, for any reason, that player is immediately pushed back and an Armour roll is made against them.

This player may Rush. Declare that the player will Rush before placing the Throw-in template and rolling the D6 to determine direction:

* If this player Rushes into an unoccupied square, move them as normal and roll a D6:
  - On a roll of 2+, this player moves without mishap.
  - On a roll of 1 (before or after modification), the player Falls Over.
* If this player Rushes into a square that is occupied by a standing player from either team, roll a D6:
  - On a roll of 2+, this player moves without mishap and will perform a Block action against the player occupying the square as described previously.
  - On a roll of 1 (before or after modification), the player occupying the square is pushed back and this player will Fall Over after moving into the vacated square.

If this player ever Falls Over, is Knocked Down or is Placed Prone, an Injury roll is immediately made against them (no Armour roll is required), treating a Stunned result as a KO’d result.

A player with this Trait cannot also have the Diving Tackle, Frenzy, Grab, Leap, Multiple Block, On the Ball or Shadowing skills.
",TRUE,
Bombardier,"When activated and if they are Standing, this player can perform a ‘Throw Bomb’ Special action. This Special action is neither a Pass action nor a Throw Team-mate action, so does not prevent another player performing one of those actions during the same team turn. However, only a single player with this Trait may perform this Special action each team turn.

A Bomb can be thrown and caught, and the throw interfered with, just like a ball, using the rules for Pass actions as described on page 48, with the following exceptions:

* A player may not stand up or move before performing a Throw Bomb action.
* Bombs do not bounce and can come to rest on the ground in an occupied square. Should a player fail to catch a Bomb, it will come to rest on the ground in the square that player occupies.
* If a Bomb is fumbled, it will explode immediately in the square occupied by the player attempting to throw it.
* If a Bomb comes to rest on the ground in an empty square or is caught by an opposition player, no Turnover is caused.
* A player that is in possession of the ball can still catch a Bomb.
* Any Skills that can be used when performing a Pass action can also be used when performing a Throw Bomb Special action, with the exception of On the Ball.

If a Bomb is caught by a player on either team, roll a D6:

* On a roll of 4+, the Bomb explodes immediately, as described below.
* On a roll of 1-3, that player must throw the Bomb again immediately. This throw takes place out of the normal sequence of play.

Should a Bomb ever leave the pitch, it explodes in the crowd with no effect (on the game) before the crowd can throw it back.

When a Bomb comes to rest on the ground, in either an unoccupied square, in a square occupied by a player that failed to catch the Bomb or in a square occupied by a Prone or Stunned player, it will explode immediately:

* If the Bomb explodes in an occupied square, that player is automatically hit by the explosion.
* Roll a D6 for each player (from either team) that occupies a square adjacent to the one in which the Bomb exploded:
  - On a roll of 4+, the player has been hit by the explosion.
  - On a roll of 1-3, the player manages to avoid the explosion.
* Any Standing players hit by the explosion are Knocked Down.
* An Armour roll (and possibly an Injury roll as well) is made against any player hit by the explosion, even if they were already Prone or Stunned.
* You may apply a +1 modifier to either the Armour roll or Injury roll.

This modifier may be applied after the roll has been made.",,
Bone Head,"When this player is activated, even if they are Prone or have lost their Tackle Zone, immediately after declaring the action they will perform but before performing the action, roll a D6:

* On a roll of 1, this player forgets what they are doing and their activation ends immediately. Additionally, this player loses their Tackle Zone until they are next activated.
* On a roll of 2+, this player continues their activation as normal and completes their declared action.

If you declared that this player would perform an action which can only be performed once per team turn and this player’s activation ended before the action could be completed, the action is considered to have been performed and no other player on your team may perform the same action this team turn.",TRUE,
Chainsaw,"Instead of performing a Block action (on its own or as part of a Blitz action), this player may perform a ‘Chainsaw Attack’ Special action. Exactly as described for a Block action, nominate a single Standing player to be the target of the Chainsaw Attack Special action. There is no limit to how many players with this Trait may perform this Special action each team turn.

To perform a Chainsaw Attack Special action, roll a D6:

* On a roll of 2+, the nominated target is hit by a Chainsaw!
* On a roll of 1, the Chainsaw will violently ‘kick-back’ and hit the player wielding it.
* In either case, an Armour roll is made against the player hit by the Chainsaw, adding +3 to the result.
* If the armour of the player hit is broken, they become Prone and an Injury roll is made against them. This Injury roll cannot be modified in any way.
* If the armour of the player hit is not broken, this Trait has no effect.

This player can only use the Chainsaw once per turn(i.e., a Chainsaw cannot be used with Frenzy or Multiple Block) and if used as part of a Blitz action, this player cannot continue moving after using it.

If this player Falls Over or is Knocked Down, the opposing coach may add +3 to the Armour roll made against the player.

If an opposition player performs a Block action targeting this player and a Player Down! or a POW! result is applied, +3 is added to the Armour roll. If a Both Down result is applied, +3 is added to both Armour rolls.

Finally, this player may use their Chainsaw when they perform a Foul action. Roll a D6 for kick-back as described above. Once again, an Armour roll is made against the player hit by the Chainsaw, adding +3 to the score.",TRUE,
Decay,"If this player suffers a Casualty result on the Injury table, there is a +1 modifier applied to all rolls made against this player on the Casualty table.",TRUE,
Hypnotic Gaze,"During their activation, this player may perform a ‘Hypnotic Gaze’ Special action. There is no limit to how many players with this Trait may perform this Special action each team turn.

To perform a Hypnotic Gaze Special action, nominate a single Standing opposition player that has not lost their Tackle Zone and that this player is Marking. Then make an Agility test for this player, applying a -1 modifier for every player (other than the nominated player) that is Marking this player. If the test is passed, the nominated player loses their Tackle Zone until they are next activated.

This player may move before performing this Special action, following all of the normal movement rules. However, once this Special action has been performed, this player may not move further and their activation comes to an This player is jealous of and dislikes certain other players on their team, as shown in brackets after the name of the Skill on this player’s profile. This may be defined by position or race. For example, a Skaven Thrower on an Underworld Denizens team has Animosity (Underworld Goblin Linemen), meaning they suffer Animosity towards any Underworld Goblin Linemen players on their team. Whereas a Skaven Renegade on a Chaos Renegade team has Animosity (all team-mates), meaning they suffer Animosity towards all of their team-mates equally.

When this player wishes to perform a Hand-off action to a team-mate of the type listed, or attempts to perform a Pass action and the target square is occupied by a team-mate of the type listed, this player may refuse to do so. Roll a D6. On a roll of 1, this player refuses to perform the action and their activation comes to an end. Animosity does not extend to Mercenaries or Star Players.",,
Kick Team-mate,"Once per team turn, in addition to another player performing either a Pass or a Throw Team-mate action, a single player with this Trait on the active team can perform a ‘Kick Team-mate’ Special action and attempt to kick a Standing team-mate with the Right Stuff trait that is in a square adjacent to them.

To perform a Kick Team-mate Special action, follow the rules for Throw Team-mate actions as described on page 52.

However, if the Kick Team-mate Special action is fumbled, the kicked player is automatically removed from play and an Injury roll is made against them, treating a Stunned result as a KO’d result (note that, if the player that performed this action also has the Mighty Blow (+X) skill, the coach of the opposing team may use that Skill on this Injury roll). If the kicked player was in possession of the ball when removed from play, the ball will bounce from the square they occupied.",,
Loner (X+),"If this player wishes to use a team re-roll, roll a D6. If you roll equal to or higher than the target number shown in brackets, this player may use the team re-roll as normal. Otherwise, the original result stands without being re-rolled but the team re-roll is lost just as if it had been used.",TRUE,
No Hands,"This player is unable to take possession of the ball. They may not attempt to pick it up, to catch it, or attempt to interfere with a pass. Any attempt to do so will automatically fail, causing the ball to bounce. Should this player voluntarily move into a square in which the ball is placed, they cannot attempt to pick it up. The ball will bounce and a Turnover is caused as if this player had failed an attempt to pick up the ball.",TRUE,
Plague Ridden,"Once per game, if an opposition player with a Strength characteristic of 4 or less that does not have the Decay, Regeneration or Stunty traits suffers a Casualty result of 15-16, DEAD as the result of a Block action performed or a Foul action committed by a player with this Trait that belongs to your team, and if that player cannot be saved by an apothecary, you may choose to use this Trait. If you do, that player does not die; they have instead been infected with a virulent plague!

If your team has the ‘Favoured of Nurgle’ special rule, a new ‘Rotter Lineman’ player, drawn from the Nurgle roster, can be placed immediately in the Reserves box of your team’s dugout (this may cause a team to have more than 16 players for the remainder of this game). During step 4 of the post-game sequence, this player may be permanently hired, exactly as you would a Journeyman player that had played for your team (see page 72).",,
Pogo Stick,"During their movement, instead of jumping over a single square that is occupied by a Prone or Stunned player, as described on page 45, a player with this Trait may choose to Leap over any single adjacent square, including unoccupied squares and squares occupied by Standing players.

Additionally, when this player makes an Agility test to Jump over a Prone or Stunned player, or to Leap over an empty square or a square occupied by a Standing player, they may ignore any negative modifiers that would normally be applied for being Marked in the square they jumped or leaped from and/or for being Marked in the square they have jumped or leaped into.

A player with this Trait cannot also have the Leap skill.",,
Projectile Vomit,"Instead of performing a Block action (on its own or as part of a Blitz action), this player may perform a ‘Projectile Vomit’ Special action. Exactly as described for a Block action, nominate a single Standing player to be the target of the Projectile Vomit Special action. There is no limit to how many players with this Trait may perform this Special action each team turn.

To perform a Projectile Vomit Special action, roll a D6:

* On a roll of 2+, this player regurgitates acidic bile onto the nominated target.
* On a roll of 1, this player belches and snorts, before covering itself in acidic bile.
* In either case, an Armour roll is made against the player hit by the Projectile Vomit. This Armour roll cannot be modified in any way.
* If the armour of the player hit is broken, they become Prone and an Injury roll is made against them. This Injury roll cannot be modified in any way.
* If the armour of the player hit is not broken, this Trait has no effect.

A player can only perform this Special action once per turn (i.e., Projectile Vomit cannot be used with Frenzy or Multiple Block).",,
Really Stupid,"When this player is activated, even if they are Prone or have lost their Tackle Zone, immediately after declaring the action they will perform but before performing the action, roll a D6, applying a +2 modifier to the dice roll if this player is currently adjacent to one or more Standing team-mates that do not have this Trait:

* On a roll of 1-3, this player forgets what they are doing and their activation ends immediately. Additionally, this player loses their Tackle Zone until they are next activated.
* On a roll of 4+, this player continues their activation as normal and completes their declared action.

Note that if you declared that this player would perform an action which can only be performed once per team turn and this player’s activation ended before the action could be completed, the action is considered to have been performed and no other player on your team may perform the same action this team turn.",TRUE,
Regeneration,"After a Casualty roll has been made against this player, roll a D6. On a roll of 4+, the Casualty roll is discarded without effect and the player is placed in the Reserves box rather than the Casualty box of their team dugout. On a roll of 1-3, however, the result of the Casualty roll is applied as normal.",,
Right Stuff,"If this player also has a Strength characteristic of 3 or less, they can be thrown by a team-mate with the Throw Team-mate skill, as described on page 52.",TRUE,
Secret Weapon,"When a drive in which this player took part ends, even ifthis player was not on the pitch at the end of the drive, thisplayer will be Sent-off for committing a Foul, as describedon page 63.",TRUE,
Stab,"Instead of performing a Block action (on its own or as part of a Blitz action), this player may perform a ‘Stab’ Special action. Exactly as described for a Block action, nominate a single Standing player to be the target of the Stab Special action. There is no limit to how many players with this Trait may perform this Special action each team turn.

To perform a Stab Special action, make an unmodified Armour roll against the target:

* If the Armour of the player hit is broken, they become Prone and an Injury roll is made against them. This Injury roll cannot be modified in any way.
* If the Armour of the player hit is not broken, this Trait has no effect.
* If Stab is used as part of a Blitz action, the player cannot continue moving after using it.",,
Stunty,"When this player makes an Agility test in order to Dodge, they ignore any -1 modifiers for being Marked in the square they have moved into, unless they also have either the Bombardier trait, the Chainsaw trait or the Swoop trait.

However, when an opposition player attempts to interfere with a Pass action performed by this player, that player may apply a +1 modifier to their Agility test.

Finally, players with this Trait are more prone to injury. Therefore, when an Injury roll is made against this player, roll 2D6 and consult the Stunty Injury table, on page 60.",TRUE,
Swarming,"During each Start of Drive sequence, after Step 2 but before Step 3, you may remove D3 players with this Trait from the Reserves box of your dugout and set them up on the pitch, allowing you to set up more than the usual 11 players. These extra players may not be placed on the Line of Scrimmage or in a Wide Zone.",,
Swoop,"If this player is thrown by a team-mate, as described on page 52, they do not scatter before landing as they normally would. Instead, you may place the Throw-in template over the player, facing towards either End Zone or either sideline as you wish. The player then moves from the target square D3 squares in a direction determined by rolling a D6 and referring to the Throw-in template.",,
Take Root,"When this player is activated, even if they are Prone or have lost their Tackle Zone, immediately after declaring the action they will perform but before performing the action, roll a D6:

* On a roll of 1, this player becomes ’Rooted’:
  - A Rooted player cannot move from the square they currently occupy for any reason, voluntarily or otherwise, until the end of this drive, or until they are Knocked Down or Placed Prone.
  - A Rooted player may perform any action available to them provided they can do so without moving. For example, a Rooted player may perform a Pass action but may not move before making the pass, and so on.
* On a roll of 2+, this player continues their activation as normal.

If you declared that this player would perform any action that includes movement (Pass, Hand-off, Blitz or Foul) prior to them becoming Rooted, they may complete the action if possible. If they cannot, the action is considered to have been performed and no other player on your team may perform the same action this team turn.",TRUE,
Throw Team-mate,"If this player also has a Strength characteristic of 5 or more, they may perform a Throw Team-mate action, as described on page 52, allowing them to throw a team-mate with the Right Stuff trait.",,
Timmm-ber!,"If this player has a Movement Allowance of 2 or less, apply a +1 modifier to the dice roll when they attempt to stand up (as described on page 44) for each Open, Standing team-mate they are currently adjacent to. A natural 1 is always a failure, no matter how many team- mates are helping.",,
Titchy,"This player may apply a +1 modifier to any Agility tests they make in order to Dodge. However, if an opposition player dodges into a square within the Tackle Zone of this player, this player does not count as Marking the moving player for the purposes of calculating Agility test modifiers.",,
Unchannelled Fury,"When this player is activated, even if they are Prone or have lost their Tackle Zone, immediately after declaring the action they will perform but before performing the action, roll a D6, applying a +2 modifier to the dice roll if you declared the player would perform a Block or Blitz action (or a Special action granted by a Skill or Trait that can be performed instead of a Block action):

* On a roll of 1-3, this player rages incoherently at others but achieves little else. Their activation ends immediately.
* On a roll of 4+, this player continues their activation as normal and completes their declared action.

If you declared that this player would perform an action which can only be performed once per team turn and this player’s activation ended before the action could be completed, the action is considered to have been performed and no other player on your team may perform the same action this team turn.",TRUE,
Breathe Fire,"Once per activation, instead of performing a Block action (either on its own or as part of a Blitz action), this player may perform a Breathe Fire Special action. When a player makes a Breathe Fire Special action they may choose one Standing opposition player they are Marking and roll a D6, applying a -1. modifier if the target has a ST of 5 or higher. On a 1, the player gets overeager, engulfing themself in flame and is immediately Knocked Down. On a 2-3, the opposition player ducks the gout of flame and nothing happens. On a 4+, the opposition player takes a ball of fire straight to the face and is immediately Placed Prone. However, if the roll is a natural 6, the potent pyro has taken its toll and the opposition player is Knocked Down instead. After the Breathe Fire Special action has been resolved, this player's activation immediately ends.",,Spike 18
Hit and Run,"After a player with this Trait performs a Block action, they may immediately move one free square ignoring Tackle Zones so long as they are still Standing. They must ensure that after this free move, they are not Marked by or Marking any opposition players.",,Spike 16
